<!ELEMENT circuito (nombre, longitud, anchura, fecha, hora, vueltas, localidad, pais, patrocinador, referencias, galeriaFotos, galeriaVideos, puntoOrigen, tramos, vencedor, clasificacion)>
<!ELEMENT nombre (#PCDATA)>
<!ELEMENT longitud (#PCDATA)>
<!ATTLIST longitud unidad CDATA #REQUIRED>
<!ELEMENT anchura (#PCDATA)>
<!ATTLIST anchura unidad CDATA #REQUIRED>
<!ELEMENT fecha (#PCDATA)>
<!ELEMENT hora (#PCDATA)>
<!ELEMENT vueltas (#PCDATA)>
<!ELEMENT localidad (#PCDATA)>
<!ELEMENT pais (#PCDATA)>
<!ELEMENT patrocinador (#PCDATA)>

<!ELEMENT referencias (referencia+)>
<!ELEMENT referencia (#PCDATA)>

<!ELEMENT galeriaFotos (foto+)>
<!ELEMENT foto (#PCDATA)>

<!ELEMENT galeriaVideos (video+)>
<!ELEMENT video (#PCDATA)>

<!ELEMENT puntoOrigen (longitud, latitud, altitud)>
<!ELEMENT latitud (#PCDATA)>
<!ATTLIST latitud unidad CDATA #REQUIRED>
<!ELEMENT altitud (#PCDATA)>
<!ATTLIST altitud unidad CDATA #REQUIRED>

<!ELEMENT tramos (tramo+)>
<!ELEMENT tramo (coordenadas, sector)>
<!ELEMENT coordenadas (longitud, latitud, altitud)>
<!ELEMENT sector (#PCDATA)>
<!ATTLIST tramo distancia CDATA #REQUIRED>

<!ELEMENT vencedor (nombre, tiempo)>
<!ELEMENT tiempo (#PCDATA)>

<!ELEMENT clasificacion (piloto+)>
<!ELEMENT piloto (#PCDATA)>